{
  "experiment_id": "ZVK-EXP-2026-000001",
  "experiment_type": "mapping_improvement",
  "corpus_id": "wazuh-mapping-corpus:0a1b2c3d4e5f6789",
  "runner_image_sha": "sha256:abcdef0123456789abcdef0123456789abcdef0123456789abcdef0123456789",
  "started_at": "2026-09-15T02:00:00Z",
  "finished_at": "2026-09-15T02:14:22Z",
  "outcome": "success",
  "candidates_produced": [
    "ZVK-CAND-2026-000001"
  ],
  "findings": [
    {
      "finding_kind": "schema_drift",
      "finding_id": "FIND-2026-0042"
    }
  ],
  "metrics": {
    "candidate_count": 1,
    "corpus_pass_rate": 1.0,
    "runtime_seconds": 862
  }
}
